text,type,admiration,amusement,anger,annoyance,approval,caring,confusion,curiosity,desire,disappointment,disapproval,disgust,embarrassment,excitement,fear,gratitude,grief,joy,love,nervousness,optimism,pride,realization,relief,remorse,sadness,surprise,neutral
Even simple tasks drain all my energy.,original,0,0,0,1,0,0,0,0,0,1,0,0,0,0,0,0,0,0,0,0,0,0,0,0,0,1,0,0
Just washing a dish feels like running a marathon; I'm spent.,augmented,0,0,0,1,0,0,0,0,0,1,0,0,0,0,0,0,0,0,0,0,0,0,0,0,0,1,0,0
The smallest chore absolutely wipes me out.,augmented,0,0,0,1,0,0,0,0,0,1,0,0,0,0,0,0,0,0,0,0,0,0,0,0,0,1,0,0
I have zero reserves; even basic things exhaust me.,augmented,0,0,0,1,0,0,0,0,0,1,0,0,0,0,0,0,0,0,0,0,0,0,0,0,0,1,0,0
It's humiliating how tired I get from doing practically nothing.,augmented,0,0,0,1,0,0,0,0,0,1,0,0,0,0,0,0,0,0,0,0,0,0,0,0,0,1,0,0
My battery is so dead that simple actions feel impossible.,augmented,0,0,0,1,0,0,0,0,0,1,0,0,0,0,0,0,0,0,0,0,0,0,0,0,0,1,0,0
People say I seem slower in responding and doing things.,original,0,0,0,0,0,0,1,0,0,0,0,0,1,0,0,0,0,0,0,0,0,0,0,0,0,1,0,0
My family keeps asking why I'm moving in slow motion.,augmented,0,0,0,0,0,0,1,0,0,0,0,0,1,0,0,0,0,0,0,0,0,0,0,0,0,1,0,0
I've been told there's a lag in my reactions and movements.,augmented,0,0,0,0,0,0,1,0,0,0,0,0,1,0,0,0,0,0,0,0,0,0,0,0,0,1,0,0
"Apparently, I'm taking forever to answer questions or get things done.",augmented,0,0,0,0,0,0,1,0,0,0,0,0,1,0,0,0,0,0,0,0,0,0,0,0,0,1,0,0
"It feels like I'm underwater, and others are noticing my slowness.",augmented,0,0,0,0,0,0,1,0,0,0,0,0,1,0,0,0,0,0,0,0,0,0,0,0,0,1,0,0
I'm getting comments about how lethargic and delayed I seem.,augmented,0,0,0,0,0,0,1,0,0,0,0,0,1,0,0,0,0,0,0,0,0,0,0,0,0,1,0,0
"I have no motivation to do anything, I just stay in bed all day.",original,0,0,0,0,0,0,0,0,0,1,0,0,0,0,0,0,0,0,0,0,0,0,0,0,0,1,0,0
"I can't find a single reason to leave my mattress, so I don't.",augmented,0,0,0,0,0,0,0,0,0,1,0,0,0,0,0,0,0,0,0,0,0,0,0,0,0,1,0,0
The drive to exist is gone; I'm just rotting in bed.,augmented,0,0,0,0,0,0,0,0,0,1,0,0,0,0,0,0,0,0,0,0,0,0,0,0,0,1,0,0
I spend my entire day under the covers because I just don't care.,augmented,0,0,0,0,0,0,0,0,0,1,0,0,0,0,0,0,0,0,0,0,0,0,0,0,0,1,0,0
Motivation is non-existent; the bed is my whole world now.,augmented,0,0,0,0,0,0,0,0,0,1,0,0,0,0,0,0,0,0,0,0,0,0,0,0,0,1,0,0
"I'm paralyzed by apathy, just lying here from morning to night.",augmented,0,0,0,0,0,0,0,0,0,1,0,0,0,0,0,0,0,0,0,0,0,0,0,0,0,1,0,0
I feel like a failure and that I let everyone down.,original,0,0,0,0,0,0,0,0,0,1,1,0,0,0,0,0,0,0,0,0,0,0,0,0,1,1,0,0
The guilt of disappointing everyone is crushing me.,augmented,0,0,0,0,0,0,0,0,0,1,1,0,0,0,0,0,0,0,0,0,0,0,0,0,1,1,0,0
I look in the mirror and just see a total screw-up.,augmented,0,0,0,0,0,0,0,0,0,1,1,0,0,0,0,0,0,0,0,0,0,0,0,0,1,1,0,0
"I've failed the people I care about, and I can't forgive myself.",augmented,0,0,0,0,0,0,0,0,0,1,1,0,0,0,0,0,0,0,0,0,0,0,0,0,1,1,0,0
I'm nothing but a disappointment to my family and friends.,augmented,0,0,0,0,0,0,0,0,0,1,1,0,0,0,0,0,0,0,0,0,0,0,0,0,1,1,0,0
It haunts me that I'm not living up to expectations.,augmented,0,0,0,0,0,0,0,0,0,1,1,0,0,0,0,0,0,0,0,0,0,0,0,0,1,1,0,0
"At times I feel I could do better, but it's not overwhelming.",original,0,0,0,0,0,0,0,0,0,1,0,0,0,0,0,0,0,0,0,0,1,0,0,0,0,0,0,0
"I have moments of self-critique, but it's nothing I can't handle.",augmented,0,0,0,0,0,0,0,0,0,1,0,0,0,0,0,0,0,0,0,0,1,0,0,0,0,0,0,0
"There's room for improvement, sure, but I'm not beating myself up.",augmented,0,0,0,0,0,0,0,0,0,1,0,0,0,0,0,0,0,0,0,0,1,0,0,0,0,0,0,0
"I know I'm not perfect, but I'm not spiraling over it either.",augmented,0,0,0,0,0,0,0,0,0,1,0,0,0,0,0,0,0,0,0,0,1,0,0,0,0,0,0,0
"I get a bit critical of myself, though it stays within reason.",augmented,0,0,0,0,0,0,0,0,0,1,0,0,0,0,0,0,0,0,0,0,1,0,0,0,0,0,0,0
"It's a healthy level of dissatisfaction, not a crushing one.",augmented,0,0,0,0,0,0,0,0,0,1,0,0,0,0,0,0,0,0,0,0,1,0,0,0,0,0,0,0
"No major changes in mood, I feel mostly okay.",original,0,0,0,0,0,0,0,0,0,0,0,0,0,0,0,0,0,0,0,0,1,0,0,1,0,0,0,1
"I'm pretty steady, no emotional rollercoasters lately.",augmented,0,0,0,0,0,0,0,0,0,0,0,0,0,0,0,0,0,0,0,0,1,0,0,1,0,0,0,1
Things are stable; I'm maintaining a decent baseline.,augmented,0,0,0,0,0,0,0,0,0,0,0,0,0,0,0,0,0,0,0,0,1,0,0,1,0,0,0,1
"I'm neither high nor low, just cruising along fine.",augmented,0,0,0,0,0,0,0,0,0,0,0,0,0,0,0,0,0,0,0,0,1,0,0,1,0,0,0,1
"Emotionally, I'm on an even keel.",augmented,0,0,0,0,0,0,0,0,0,0,0,0,0,0,0,0,0,0,0,0,1,0,0,1,0,0,0,1
I haven't felt any drastic shifts; I'm doing alright.,augmented,0,0,0,0,0,0,0,0,0,0,0,0,0,0,0,0,0,0,0,0,1,0,0,1,0,0,0,1
"I can’t focus at all, everything seems blurry in my head.",original,0,0,0,1,0,0,1,0,0,0,0,0,0,0,0,0,0,0,0,1,0,0,0,0,0,1,0,0
My thoughts are just a cloud of static; I can't grasp anything.,augmented,0,0,0,1,0,0,1,0,0,0,0,0,0,0,0,0,0,0,0,1,0,0,0,0,0,1,0,0
Concentration is a joke; my mind is completely fuzzy.,augmented,0,0,0,1,0,0,1,0,0,0,0,0,0,0,0,0,0,0,0,1,0,0,0,0,0,1,0,0
"I try to think, but it's like wading through thick fog.",augmented,0,0,0,1,0,0,1,0,0,0,0,0,0,0,0,0,0,0,0,1,0,0,0,0,0,1,0,0
It's scary how scattered and blurry my mental state is.,augmented,0,0,0,1,0,0,1,0,0,0,0,0,0,0,0,0,0,0,0,1,0,0,0,0,0,1,0,0
I can't pin down a single thought; it's all just noise.,augmented,0,0,0,1,0,0,1,0,0,0,0,0,0,0,0,0,0,0,0,1,0,0,0,0,0,1,0,0
"My appetite fluctuates, but nothing drastic.",original,0,0,0,0,0,0,0,0,0,0,0,0,0,0,0,0,0,0,0,0,0,0,0,0,0,0,0,1
"I eat more some days than others, but it's pretty standard.",augmented,0,0,0,0,0,0,0,0,0,0,0,0,0,0,0,0,0,0,0,0,0,0,0,0,0,0,0,1
"Hunger comes and goes, but I'm not starving or bingeing.",augmented,0,0,0,0,0,0,0,0,0,0,0,0,0,0,0,0,0,0,0,0,0,0,0,0,0,0,0,1
"There's a little variance in my meals, but nothing concerning.",augmented,0,0,0,0,0,0,0,0,0,0,0,0,0,0,0,0,0,0,0,0,0,0,0,0,0,0,0,1
"I'm not strictly regular with food, but it's not a problem.",augmented,0,0,0,0,0,0,0,0,0,0,0,0,0,0,0,0,0,0,0,0,0,0,0,0,0,0,0,1
"Appetite is a bit wavy, yet overall I'm eating enough.",augmented,0,0,0,0,0,0,0,0,0,0,0,0,0,0,0,0,0,0,0,0,0,0,0,0,0,0,0,1
My appetite is all over the place; I either overeat or don’t eat at all.,original,0,0,0,1,0,0,1,0,0,0,0,0,0,0,0,0,0,0,0,0,0,0,0,0,0,1,0,0
"It's chaotic—some days I stuff myself, and other days I can't look at food.",augmented,0,0,0,1,0,0,1,0,0,0,0,0,0,0,0,0,0,0,0,0,0,0,0,0,0,1,0,0
I can't seem to find a middle ground with eating; it's always one extreme or the other.,augmented,0,0,0,1,0,0,1,0,0,0,0,0,0,0,0,0,0,0,0,0,0,0,0,0,0,1,0,0
"My eating habits are totally erratic, swinging between binging and starving.",augmented,0,0,0,1,0,0,1,0,0,0,0,0,0,0,0,0,0,0,0,0,0,0,0,0,0,1,0,0
It's frustrating because I have no control; I'm either empty or too full.,augmented,0,0,0,1,0,0,1,0,0,0,0,0,0,0,0,0,0,0,0,0,0,0,0,0,0,1,0,0
I don't know what normal is anymore; I skip meals or eat everything in sight.,augmented,0,0,0,1,0,0,1,0,0,0,0,0,0,0,0,0,0,0,0,0,0,0,0,0,0,1,0,0
No noticeable change in movement or activity levels.,original,0,0,0,0,0,0,0,0,0,0,0,0,0,0,0,0,0,0,0,0,0,0,0,0,0,0,0,1
I'm moving around just as much as I usually do.,augmented,0,0,0,0,0,0,0,0,0,0,0,0,0,0,0,0,0,0,0,0,0,0,0,0,0,0,0,1
My physical activity has remained pretty constant.,augmented,0,0,0,0,0,0,0,0,0,0,0,0,0,0,0,0,0,0,0,0,0,0,0,0,0,0,0,1
I haven't been more sluggish or more restless; it's the same.,augmented,0,0,0,0,0,0,0,0,0,0,0,0,0,0,0,0,0,0,0,0,0,0,0,0,0,0,0,1
There's really no difference in how active I am.,augmented,0,0,0,0,0,0,0,0,0,0,0,0,0,0,0,0,0,0,0,0,0,0,0,0,0,0,0,1
I'm maintaining my normal rhythm of movement.,augmented,0,0,0,0,0,0,0,0,0,0,0,0,0,0,0,0,0,0,0,0,0,0,0,0,0,0,0,1
I feel tired even after a full night's sleep.,original,0,0,0,1,0,0,0,0,0,1,0,0,0,0,0,0,0,0,0,0,0,0,0,0,0,1,0,0
It feels pointless to sleep because I wake up just as exhausted.,augmented,0,0,0,1,0,0,0,0,0,1,0,0,0,0,0,0,0,0,0,0,0,0,0,0,0,1,0,0
"I'm getting eight hours, but the fatigue won't go away.",augmented,0,0,0,1,0,0,0,0,0,1,0,0,0,0,0,0,0,0,0,0,0,0,0,0,0,1,0,0
Rest doesn't refresh me; I'm drained from the minute I wake up.,augmented,0,0,0,1,0,0,0,0,0,1,0,0,0,0,0,0,0,0,0,0,0,0,0,0,0,1,0,0
It's disheartening to sleep through the night and still feel this heavy.,augmented,0,0,0,1,0,0,0,0,0,1,0,0,0,0,0,0,0,0,0,0,0,0,0,0,0,1,0,0
Sleep isn't working; I'm perpetually tired regardless of how long I stay in bed.,augmented,0,0,0,1,0,0,0,0,0,1,0,0,0,0,0,0,0,0,0,0,0,0,0,0,0,1,0,0
"I have thoughts about self-harm, but I don’t tell anyone.",original,0,0,0,0,0,0,0,0,0,0,0,0,0,0,1,0,0,0,0,1,0,0,0,0,0,1,0,0
"I keep it a secret, but I do think about hurting myself.",augmented,0,0,0,0,0,0,0,0,0,0,0,0,0,0,1,0,0,0,0,1,0,0,0,0,0,1,0,0
There are these dark urges to injure myself that I'm too afraid to share.,augmented,0,0,0,0,0,0,0,0,0,0,0,0,0,0,1,0,0,0,0,1,0,0,0,0,0,1,0,0
I'm fighting a private battle with self-harm ideation.,augmented,0,0,0,0,0,0,0,0,0,0,0,0,0,0,1,0,0,0,0,1,0,0,0,0,0,1,0,0
"No one knows this, but I have visions of harming my body.",augmented,0,0,0,0,0,0,0,0,0,0,0,0,0,0,1,0,0,0,0,1,0,0,0,0,0,1,0,0
I haven't told a soul that I want to cause myself pain.,augmented,0,0,0,0,0,0,0,0,0,0,0,0,0,0,1,0,0,0,0,1,0,0,0,0,0,1,0,0
"I frequently think about ending everything, I don’t see a way out.",original,0,0,0,0,0,0,0,0,0,0,0,0,0,0,1,0,1,0,0,0,0,0,0,0,0,1,0,0
"I'm trapped in this hopelessness, and suicide seems like the only escape.",augmented,0,0,0,0,0,0,0,0,0,0,0,0,0,0,1,0,1,0,0,0,0,0,0,0,0,1,0,0
"There are no options left for me, so I constantly think about death.",augmented,0,0,0,0,0,0,0,0,0,0,0,0,0,0,1,0,1,0,0,0,0,0,0,0,0,1,0,0
I am consumed by the idea of ending my life because I can't survive this.,augmented,0,0,0,0,0,0,0,0,0,0,0,0,0,0,1,0,1,0,0,0,0,0,0,0,0,1,0,0
"I look for a future and see nothing, so ending it all feels inevitable.",augmented,0,0,0,0,0,0,0,0,0,0,0,0,0,0,1,0,1,0,0,0,0,0,0,0,0,1,0,0
The thought of checking out is always there because I truly see no other solution.,augmented,0,0,0,0,0,0,0,0,0,0,0,0,0,0,1,0,1,0,0,0,0,0,0,0,0,1,0,0
